{
  "$schema": "./runtime-manifest.schema.json",
  "artifacts": {
    "checksums": "checksums.txt",
    "detector_summary": "detector-summary.json",
    "graph_export": "graph.db.zst",
    "knowledge_export": "knowledge-export.jsonl",
    "release_prefix": "browseforge-runtime-chromium"
  },
  "binary": {
    "linux-x64": {
      "packaged": true,
      "relative_path": "chrome"
    },
    "linux-arm64": {
      "packaged": true,
      "relative_path": "chrome"
    },
    "macos-arm64": {
      "packaged": true,
      "relative_path": "Chromium.app/Contents/MacOS/Chromium"
    },
    "macos-x64": {
      "packaged": true,
      "relative_path": "Chromium.app/Contents/MacOS/Chromium"
    },
    "windows-x64": {
      "packaged": true,
      "relative_path": "chrome.exe"
    }
  },
  "browseforge": {
    "min_version": "v2.0.0",
    "profile_field": "runtime_id",
    "runtime_id": "browseforge-chromium"
  },
  "capabilities": {
    "agent_web_sessions": true,
    "native_proxy": true,
    "persistent_context": true,
    "playwright_bind": true,
    "requires_external_binary": true,
    "seed_fingerprint": true,
    "structured_config": true,
    "webrtc_masking": true
  },
  "family": "chromium",
  "fingerprint": {
    "seed_input": "uint32",
    "surfaces": [
      "seed_identity",
      "user_agent",
      "client_hints",
      "timezone",
      "locale",
      "screen",
      "hardware",
      "canvas",
      "webgl",
      "audio",
      "fonts",
      "permissions",
      "webrtc",
      "proxy_ip_coherence",
      "storage_quota",
      "automation_signals"
    ]
  },
  "id": "browseforge-chromium",
  "name": "BrowseForge Chromium Runtime",
  "profile": {
    "lock_policy": "runtime must fail clearly or repair transient locks without corrupting profile data",
    "migration_policy": "same-family Chromium profile migration may be supported only after explicit evidence",
    "user_data_dir_policy": "one persistent user data directory per BrowseForge profile"
  },
  "status": "alpha",
  "version": "v0.1.5-alpha.0"
}
